{
  "$schema": "https://json-schema.org/draft/2020-12/schema",
  "$id": "https://publedge.org/schema/json/record.schema.json",
  "title": "PubLedge record.json",
  "description": "JSON shape returned by the `.json` endpoint on each PubLedge record page.",
  "type": "object",
  "required": [
    "@context",
    "meta",
    "record",
    "jsonld"
  ],
  "properties": {
    "@context": {
      "type": "string",
      "format": "uri"
    },
    "meta": {
      "type": "object",
      "required": [
        "canonical_url",
        "generated",
        "admission"
      ],
      "properties": {
        "canonical_url": {
          "type": "string",
          "format": "uri"
        },
        "generated": {
          "type": "string",
          "format": "date-time"
        },
        "schema": {
          "type": [
            "string",
            "null"
          ]
        },
        "admission": {
          "type": "object",
          "required": [
            "status",
            "limits"
          ],
          "properties": {
            "status": {
              "type": "string",
              "enum": [
                "legacy-unreviewed",
                "reviewed-changes"
              ]
            },
            "limits": {
              "type": "string",
              "minLength": 1
            }
          },
          "additionalProperties": false
        }
      },
      "additionalProperties": true
    },
    "record": {
      "type": "object",
      "required": [
        "id",
        "type",
        "source",
        "authority",
        "jurisdiction",
        "url",
        "status",
        "editorial_status"
      ],
      "properties": {
        "id": {
          "type": "string",
          "description": "Stable identifier matching the record frontmatter id."
        },
        "legacy_id": {
          "type": [
            "string",
            "null"
          ]
        },
        "official_ref": {
          "type": [
            "string",
            "null"
          ]
        },
        "instance": {
          "type": [
            "string",
            "null"
          ]
        },
        "slug": {
          "type": [
            "string",
            "null"
          ]
        },
        "title": {
          "type": [
            "string",
            "null"
          ]
        },
        "type": {
          "type": [
            "string",
            "null"
          ],
          "enum": [
            "rma",
            "jia",
            "statute",
            "advisory-opinion",
            "interpretive-letter",
            "private-letter-ruling",
            "no-action-letter"
          ]
        },
        "source": {
          "type": "string",
          "enum": [
            "authority-issued",
            "demonstration-remap",
            "publedge-original-draft",
            "authoritative-reference"
          ]
        },
        "jurisdiction": {
          "type": [
            "string",
            "null"
          ],
          "description": "ISO-like jurisdiction (e.g. us-ut, us)."
        },
        "authority": {
          "type": [
            "string",
            "null"
          ],
          "description": "Authority slug (e.g. utah-oaip, cfpb, irs-chief-counsel)."
        },
        "url": {
          "type": [
            "string",
            "null"
          ],
          "format": "uri"
        },
        "issued_by": {
          "type": [
            "object",
            "string",
            "array",
            "null"
          ]
        },
        "author_or_proponent": {
          "type": [
            "string",
            "null"
          ]
        },
        "intended_authority": {
          "type": [
            "string",
            "null"
          ]
        },
        "intended_authority_url": {
          "type": [
            "string",
            "null"
          ],
          "format": "uri"
        },
        "issuance_event": {
          "type": [
            "string",
            "null"
          ]
        },
        "enacted": {
          "type": [
            "string",
            "null"
          ],
          "format": "date"
        },
        "effective": {
          "type": [
            "string",
            "null"
          ],
          "format": "date"
        },
        "official_url": {
          "type": [
            "string",
            "null"
          ],
          "format": "uri"
        },
        "obligation_kind": {
          "type": [
            "array",
            "string",
            "null"
          ],
          "items": {
            "type": "string",
            "enum": [
              "requirement",
              "restriction",
              "permission"
            ]
          }
        },
        "reliance_scope": {
          "type": [
            "string",
            "null"
          ],
          "enum": [
            "public",
            "similarly-situated-third-parties",
            "requesting-party-only"
          ]
        },
        "parties": {
          "type": [
            "array",
            "string",
            "null"
          ]
        },
        "statute_anchors": {
          "type": [
            "array",
            "null"
          ],
          "items": {
            "type": [
              "object",
              "string"
            ]
          }
        },
        "publication_citations": {
          "type": [
            "array",
            "null"
          ],
          "items": {
            "type": [
              "object",
              "string"
            ]
          }
        },
        "terms": {
          "type": [
            "array",
            "string",
            "null"
          ]
        },
        "status": {
          "type": [
            "string",
            "null"
          ],
          "enum": [
            "proposed",
            "enacted",
            "enforcing",
            "phased-enforcement",
            "pending-replacement",
            "expired",
            "superseded",
            "withdrawn",
            "terminated"
          ]
        },
        "editorial_status": {
          "type": [
            "string",
            "null"
          ],
          "enum": [
            "draft",
            "reviewed",
            "published"
          ]
        },
        "supersedes": {
          "type": [
            "string",
            "null"
          ]
        },
        "superseded_by": {
          "type": [
            "string",
            "null"
          ]
        },
        "authority_response": {
          "type": [
            "array",
            "null"
          ],
          "items": {
            "type": "object",
            "required": [
              "from",
              "date",
              "position"
            ],
            "properties": {
              "from": {
                "type": "string"
              },
              "date": {
                "type": "string",
                "format": "date"
              },
              "position": {
                "type": "string",
                "enum": [
                  "concurs",
                  "disputes",
                  "clarifies",
                  "declines-to-comment",
                  "superseded-by-official"
                ]
              },
              "statement": {
                "type": [
                  "string",
                  "null"
                ]
              },
              "source": {
                "type": [
                  "string",
                  "null"
                ],
                "format": "uri"
              },
              "signature": {
                "type": [
                  "string",
                  "null"
                ]
              }
            },
            "additionalProperties": true,
            "anyOf": [
              {
                "required": [
                  "statement"
                ]
              },
              {
                "required": [
                  "source"
                ]
              }
            ]
          }
        },
        "last_verified": {
          "type": [
            "string",
            "null"
          ],
          "format": "date"
        },
        "timeline": {
          "type": "array",
          "items": {
            "type": "object"
          }
        },
        "source_documents": {
          "type": "array",
          "items": {
            "type": "object"
          }
        }
      },
      "additionalProperties": true,
      "allOf": [
        {
          "if": {
            "allOf": [
              {
                "properties": {
                  "source": {
                    "const": "authority-issued"
                  }
                },
                "required": [
                  "source"
                ]
              },
              {
                "anyOf": [
                  {
                    "properties": {
                      "editorial_status": {
                        "const": "published"
                      }
                    },
                    "required": [
                      "editorial_status"
                    ]
                  },
                  {
                    "properties": {
                      "status": {
                        "const": "enforcing"
                      }
                    },
                    "required": [
                      "status"
                    ]
                  }
                ]
              }
            ]
          },
          "then": {
            "required": [
              "official_url",
              "publication_citations",
              "source_documents",
              "issuance_event",
              "enacted"
            ],
            "properties": {
              "official_url": {
                "type": "string",
                "format": "uri"
              },
              "publication_citations": {
                "type": "array",
                "minItems": 1
              },
              "source_documents": {
                "type": "array",
                "minItems": 1
              },
              "issuance_event": {
                "type": "string",
                "minLength": 1
              },
              "enacted": {
                "type": "string",
                "format": "date"
              }
            }
          }
        },
        {
          "if": {
            "properties": {
              "source": {
                "const": "publedge-original-draft"
              },
              "status": {
                "not": {
                  "const": "proposed"
                }
              }
            },
            "required": [
              "source",
              "status"
            ]
          },
          "then": {
            "not": {}
          }
        },
        {
          "if": {
            "properties": {
              "source": {
                "const": "publedge-original-draft"
              }
            },
            "required": [
              "source"
            ]
          },
          "then": {
            "properties": {
              "issued_by": {
                "type": "null"
              },
              "issuance_event": {
                "type": "null"
              },
              "enacted": {
                "type": "null"
              }
            }
          }
        }
      ]
    },
    "jsonld": {
      "type": "object",
      "required": [
        "@context",
        "@type"
      ],
      "additionalProperties": true
    }
  },
  "additionalProperties": true
}