{
  "@context": "https://schema.org",
  "meta": {
    "canonical_url": "https://publedge.org/us/federal/irs-tege/plr/2026-001/",
    "generated": "2026-09-23T00:00:00.000Z",
    "schema": "https://publedge.org/schema/instrument.schema.json",
    "admission": {
      "status": "legacy-unreviewed",
      "limits": "Traceability and declared review only; no automatic legal truth, completeness, authenticated reviewer identity, or currentness certification."
    }
  },
  "record": {
    "id": "us-irs-tege-plr-2026-001",
    "legacy_id": null,
    "official_ref": "PLR 202614036",
    "instance": "2026-001",
    "slug": "irs-plr-202614036",
    "title": "IRS PLR 202614036 — Adverse Determination: §501(c)(3) Exemption Denied, Mixed-Use Facility",
    "type": "private-letter-ruling",
    "source": "demonstration-remap",
    "jurisdiction": "us",
    "authority": "irs-tege",
    "url": "https://publedge.org/us/federal/irs-tege/plr/2026-001/",
    "issued_by": {
      "@type": "https://w3id.org/semanticarts/ns/ontology/gist/GovernmentOrganization",
      "name": "Internal Revenue Service, Tax Exempt and Government Entities",
      "ref": "https://irs.gov/privacy-disclosure/written-determinations"
    },
    "author_or_proponent": null,
    "intended_authority": null,
    "intended_authority_url": null,
    "issuance_event": "gist:Determination",
    "enacted": "2026-01-12",
    "effective": "2026-01-12",
    "official_url": "https://irs.gov/pub/irs-wd/202614036.pdf",
    "obligation_kind": [
      "restriction"
    ],
    "reliance_scope": "requesting-party-only",
    "parties": [],
    "statute_anchors": [
      {
        "cite": "26 U.S.C. §501(c)(3) (charitable organization exemption)",
        "url": "https://www.law.cornell.edu/uscode/text/26/501"
      },
      {
        "cite": "26 U.S.C. §501(a) (general exemption from federal income tax)",
        "url": "https://www.law.cornell.edu/uscode/text/26/501"
      },
      {
        "cite": "Treas. Reg. §1.501(c)(3)-1 (organizational and operational tests)",
        "url": "https://www.ecfr.gov/current/title-26/chapter-I/subchapter-A/part-1/section-1.501(c)(3)-1"
      },
      {
        "cite": "26 U.S.C. §170 (charitable contribution deductions)",
        "url": "https://www.law.cornell.edu/uscode/text/26/170"
      }
    ],
    "publication_citations": [
      {
        "cite": "IRS Written Determinations, PLR 202614036 (Jan. 12, 2026; released Apr. 3, 2026)",
        "url": "https://irs.gov/pub/irs-wd/202614036.pdf"
      }
    ],
    "terms": null,
    "status": "enforcing",
    "editorial_status": "published",
    "supersedes": null,
    "superseded_by": null,
    "authority_response": null,
    "last_verified": "2026-04-19",
    "timeline": [],
    "source_documents": []
  },
  "jsonld": {
    "@context": "https://schema.org",
    "@type": "LegalDocument",
    "identifier": "us-irs-tege-plr-2026-001",
    "alternateName": "PLR 202614036",
    "name": "IRS PLR 202614036 — Adverse Determination: §501(c)(3) Exemption Denied, Mixed-Use Facility",
    "headline": "IRS PLR 202614036 — Adverse Determination: §501(c)(3) Exemption Denied, Mixed-Use Facility",
    "description": "Private Letter Ruling (us)",
    "url": "https://publedge.org/us/federal/irs-tege/plr/2026-001/",
    "sameAs": [
      "https://irs.gov/pub/irs-wd/202614036.pdf"
    ],
    "dateCreated": "2026-04-19",
    "dateModified": "2026-04-19",
    "datePublished": "2026-01-12",
    "author": {
      "@type": "https://w3id.org/semanticarts/ns/ontology/gist/GovernmentOrganization",
      "name": "Internal Revenue Service, Tax Exempt and Government Entities",
      "url": "https://irs.gov/privacy-disclosure/written-determinations"
    },
    "about": [
      {
        "@type": "Legislation",
        "name": "26 U.S.C. §501(c)(3) (charitable organization exemption)",
        "url": "https://www.law.cornell.edu/uscode/text/26/501"
      },
      {
        "@type": "Legislation",
        "name": "26 U.S.C. §501(a) (general exemption from federal income tax)",
        "url": "https://www.law.cornell.edu/uscode/text/26/501"
      },
      {
        "@type": "Legislation",
        "name": "Treas. Reg. §1.501(c)(3)-1 (organizational and operational tests)",
        "url": "https://www.ecfr.gov/current/title-26/chapter-I/subchapter-A/part-1/section-1.501(c)(3)-1"
      },
      {
        "@type": "Legislation",
        "name": "26 U.S.C. §170 (charitable contribution deductions)",
        "url": "https://www.law.cornell.edu/uscode/text/26/170"
      }
    ],
    "license": "Demonstration remap of a publicly archived authority artifact. Not an authority-issued PubLedge instrument. The official source controls."
  }
}