{
  "@context": "https://schema.org",
  "meta": {
    "canonical_url": "https://publedge.org/us/utah/legislature/statute/2024-001/",
    "generated": "2026-09-23T00:00:00.000Z",
    "schema": "https://publedge.org/schema/instrument.schema.json",
    "admission": {
      "status": "reviewed-changes",
      "limits": "Traceability and declared review only; no automatic legal truth, completeness, authenticated reviewer identity, or currentness certification."
    }
  },
  "record": {
    "id": "us-ut-legislature-statute-2024-sb149",
    "legacy_id": null,
    "official_ref": null,
    "instance": "2024-001",
    "slug": "utah-sb149-ai-amendments",
    "title": "Utah SB 149 (2024) — Artificial Intelligence Amendments",
    "type": "statute",
    "source": "authoritative-reference",
    "jurisdiction": "us-ut",
    "authority": "utah-legislature",
    "url": "https://publedge.org/us/utah/legislature/statute/2024-001/",
    "issued_by": {
      "@type": "https://w3id.org/semanticarts/ns/ontology/gist/SubCountryGovernment",
      "name": "Utah State Legislature",
      "ref": "https://le.utah.gov/"
    },
    "author_or_proponent": null,
    "intended_authority": null,
    "intended_authority_url": null,
    "issuance_event": "gist:Enactment",
    "enacted": "2024-03-13",
    "effective": "2024-05-01",
    "official_url": "https://le.utah.gov/~2024/bills/static/SB0149.html",
    "obligation_kind": [
      "requirement",
      "restriction",
      "permission"
    ],
    "reliance_scope": "public",
    "parties": null,
    "statute_anchors": [
      {
        "cite": "Utah Code Title 13, Chapter 72 (Artificial Intelligence Policy Act)",
        "url": "https://le.utah.gov/xcode/Title13/Chapter72/13-72.html"
      },
      {
        "cite": "Utah Code §76-2-107 (criminal liability for AI-assisted offenses)",
        "url": "https://le.utah.gov/xcode/Title76/Chapter2/76-2-S107.html"
      },
      {
        "cite": "Utah Code §13-2-12 (original GenAI disclosure — repealed by SB 226)",
        "url": "https://le.utah.gov/~2024/bills/static/SB0149.html"
      }
    ],
    "publication_citations": [
      {
        "cite": "Utah SB 149 (2024 General Session), Governor Signed March 13, 2024",
        "url": "https://le.utah.gov/~2024/bills/static/SB0149.html"
      }
    ],
    "terms": null,
    "status": "enforcing",
    "editorial_status": "published",
    "supersedes": null,
    "superseded_by": null,
    "authority_response": null,
    "last_verified": "2026-09-23",
    "timeline": [
      {
        "milestone": "Introduced",
        "date": "2024-01-26",
        "notes": "Senate 1st reading, to Senate Rules Committee (numbered and publicly distributed 2024-01-25)"
      },
      {
        "milestone": "Senate passed",
        "date": "2024-02-13",
        "notes": "26-0-3 on 3rd reading (2nd reading 2024-02-12, 22-0-7)"
      },
      {
        "milestone": "House passed",
        "date": "2024-02-28",
        "notes": "73-0-2"
      },
      {
        "milestone": "Governor Signed",
        "date": "2024-03-13",
        "notes": "Gov. Cox"
      },
      {
        "milestone": "Effective",
        "date": "2024-05-01",
        "notes": "Office of AI Policy operational, §76-2-107 criminal mirror, §13-2-12 disclosure"
      },
      {
        "milestone": "Boyd appointed",
        "date": "2024-04-30",
        "notes": "First Director, Office of AI Policy (unconfirmed: not in the enrolled bill or bill status page)"
      },
      {
        "milestone": "Amended by SB 226",
        "date": "2025-05-07",
        "notes": "§13-2-12 repealed; disclosure moved to Chapter 75"
      },
      {
        "milestone": "HB 452 effective",
        "date": "2025-05-07",
        "notes": "Related Chapter 72a (mental health chatbots) enacted; HB 452 amends no section SB 149 enacted"
      },
      {
        "milestone": "Amended by HB 320",
        "date": "2026-05-06",
        "notes": "Chapter 72 restructured; Learning Lab + JIA instrument added"
      },
      {
        "milestone": "Chapter 72 sunset",
        "date": "2027-07-01",
        "notes": "Office + Lab + agreements expire unless extended"
      }
    ],
    "source_documents": []
  },
  "jsonld": {
    "@context": "https://schema.org",
    "@type": "LegalDocument",
    "identifier": "us-ut-legislature-statute-2024-sb149",
    "name": "Utah SB 149 (2024) — Artificial Intelligence Amendments",
    "headline": "Utah SB 149 (2024) — Artificial Intelligence Amendments",
    "description": "Statute (us-ut)",
    "url": "https://publedge.org/us/utah/legislature/statute/2024-001/",
    "sameAs": [
      "https://le.utah.gov/~2024/bills/static/SB0149.html"
    ],
    "dateCreated": "2026-04-21",
    "dateModified": "2026-09-23",
    "datePublished": "2024-05-01",
    "author": {
      "@type": "https://w3id.org/semanticarts/ns/ontology/gist/SubCountryGovernment",
      "name": "Utah State Legislature",
      "url": "https://le.utah.gov/"
    },
    "about": [
      {
        "@type": "Legislation",
        "name": "Utah Code Title 13, Chapter 72 (Artificial Intelligence Policy Act)",
        "url": "https://le.utah.gov/xcode/Title13/Chapter72/13-72.html"
      },
      {
        "@type": "Legislation",
        "name": "Utah Code §76-2-107 (criminal liability for AI-assisted offenses)",
        "url": "https://le.utah.gov/xcode/Title76/Chapter2/76-2-S107.html"
      },
      {
        "@type": "Legislation",
        "name": "Utah Code §13-2-12 (original GenAI disclosure — repealed by SB 226)",
        "url": "https://le.utah.gov/~2024/bills/static/SB0149.html"
      }
    ],
    "license": "Public statute, regulation, or rule reference. The official source controls. PubLedge does not issue authoritative interpretations of public law."
  }
}