{
  "@context": "https://schema.org",
  "meta": {
    "canonical_url": "https://publedge.org/us/federal/cftc-dsio/il/2017-001/",
    "generated": "2026-09-23T00:00:00.000Z",
    "schema": "https://publedge.org/schema/instrument.schema.json",
    "admission": {
      "status": "legacy-unreviewed",
      "limits": "Traceability and declared review only; no automatic legal truth, completeness, authenticated reviewer identity, or currentness certification."
    }
  },
  "record": {
    "id": "us-cftc-dsio-il-2017-001",
    "legacy_id": null,
    "official_ref": "CFTC Letter 17-65",
    "instance": "2017-001",
    "slug": "cftc-fia-cta-registration-2017",
    "title": "CFTC Letter 17-65 — CTA Registration Exemption Survives MiFID II Fee Unbundling",
    "type": "interpretive-letter",
    "source": "demonstration-remap",
    "jurisdiction": "us",
    "authority": "cftc-dsio",
    "url": "https://publedge.org/us/federal/cftc-dsio/il/2017-001/",
    "issued_by": {
      "@type": "https://w3id.org/semanticarts/ns/ontology/gist/GovernmentOrganization",
      "name": "U.S. Commodity Futures Trading Commission, Division of Swap Dealer and Intermediary Oversight",
      "ref": "https://cftc.gov/LawRegulation/CFTCStaffLetters/index.htm"
    },
    "author_or_proponent": null,
    "intended_authority": null,
    "intended_authority_url": null,
    "issuance_event": "gist:Determination",
    "enacted": "2017-12-11",
    "effective": "2017-12-11",
    "official_url": "https://cftc.gov/csl/17-65/download",
    "obligation_kind": [
      "permission"
    ],
    "reliance_scope": "similarly-situated-third-parties",
    "parties": [],
    "statute_anchors": [
      {
        "cite": "7 U.S.C. §1a(12) (Commodity Exchange Act definition of commodity trading advisor)",
        "url": "https://www.law.cornell.edu/uscode/text/7/1a"
      },
      {
        "cite": "17 C.F.R. §4.6(a)(3) (swap dealer exclusion from CTA definition)",
        "url": "https://www.ecfr.gov/current/title-17/chapter-I/part-4/section-4.6"
      },
      {
        "cite": "17 C.F.R. §4.14(a)(6) (introducing broker exemption from CTA registration)",
        "url": "https://www.ecfr.gov/current/title-17/chapter-I/part-4/section-4.14"
      }
    ],
    "publication_citations": [
      {
        "cite": "CFTC Letter No. 17-65, Interpretation (Dec. 11, 2017)",
        "url": "https://cftc.gov/csl/17-65/download"
      }
    ],
    "terms": null,
    "status": "enforcing",
    "editorial_status": "published",
    "supersedes": null,
    "superseded_by": null,
    "authority_response": null,
    "last_verified": "2026-04-19",
    "timeline": [],
    "source_documents": []
  },
  "jsonld": {
    "@context": "https://schema.org",
    "@type": "LegalDocument",
    "identifier": "us-cftc-dsio-il-2017-001",
    "alternateName": "CFTC Letter 17-65",
    "name": "CFTC Letter 17-65 — CTA Registration Exemption Survives MiFID II Fee Unbundling",
    "headline": "CFTC Letter 17-65 — CTA Registration Exemption Survives MiFID II Fee Unbundling",
    "description": "Interpretive Letter (us)",
    "url": "https://publedge.org/us/federal/cftc-dsio/il/2017-001/",
    "sameAs": [
      "https://cftc.gov/csl/17-65/download"
    ],
    "dateCreated": "2026-04-19",
    "dateModified": "2026-04-19",
    "datePublished": "2017-12-11",
    "author": {
      "@type": "https://w3id.org/semanticarts/ns/ontology/gist/GovernmentOrganization",
      "name": "U.S. Commodity Futures Trading Commission, Division of Swap Dealer and Intermediary Oversight",
      "url": "https://cftc.gov/LawRegulation/CFTCStaffLetters/index.htm"
    },
    "about": [
      {
        "@type": "Legislation",
        "name": "7 U.S.C. §1a(12) (Commodity Exchange Act definition of commodity trading advisor)",
        "url": "https://www.law.cornell.edu/uscode/text/7/1a"
      },
      {
        "@type": "Legislation",
        "name": "17 C.F.R. §4.6(a)(3) (swap dealer exclusion from CTA definition)",
        "url": "https://www.ecfr.gov/current/title-17/chapter-I/part-4/section-4.6"
      },
      {
        "@type": "Legislation",
        "name": "17 C.F.R. §4.14(a)(6) (introducing broker exemption from CTA registration)",
        "url": "https://www.ecfr.gov/current/title-17/chapter-I/part-4/section-4.14"
      }
    ],
    "license": "Demonstration remap of a publicly archived authority artifact. Not an authority-issued PubLedge instrument. The official source controls."
  }
}