{
  "@context": "https://schema.org",
  "meta": {
    "canonical_url": "https://publedge.org/us/federal/irs-chief-counsel/plr/2025-001/",
    "generated": "2026-09-23T00:00:00.000Z",
    "schema": "https://publedge.org/schema/instrument.schema.json",
    "admission": {
      "status": "legacy-unreviewed",
      "limits": "Traceability and declared review only; no automatic legal truth, completeness, authenticated reviewer identity, or currentness certification."
    }
  },
  "record": {
    "id": "us-irs-chief-counsel-plr-2025-001",
    "legacy_id": null,
    "official_ref": "PLR 202506001",
    "instance": "2025-001",
    "slug": "irs-plr-202506001",
    "title": "IRS Private Letter Ruling 202506001 — Management Contract Private Business Use (§141)",
    "type": "private-letter-ruling",
    "source": "demonstration-remap",
    "jurisdiction": "us",
    "authority": "irs-chief-counsel",
    "url": "https://publedge.org/us/federal/irs-chief-counsel/plr/2025-001/",
    "issued_by": {
      "@type": "https://w3id.org/semanticarts/ns/ontology/gist/GovernmentOrganization",
      "name": "Internal Revenue Service, Office of Chief Counsel",
      "ref": "https://www.irs.gov/privacy-disclosure/written-determinations"
    },
    "author_or_proponent": null,
    "intended_authority": null,
    "intended_authority_url": null,
    "issuance_event": "gist:Determination",
    "enacted": "2025-02-07",
    "effective": "2025-02-07",
    "official_url": "https://www.irs.gov/pub/irs-wd/202506001.pdf",
    "obligation_kind": [
      "permission"
    ],
    "reliance_scope": "requesting-party-only",
    "parties": [],
    "statute_anchors": [
      {
        "cite": "26 U.S.C. §141 (private business use of tax-exempt bond proceeds)",
        "url": "https://www.law.cornell.edu/uscode/text/26/141"
      },
      {
        "cite": "Rev. Proc. 2017-13 (management-contract safe harbor)",
        "url": "https://www.irs.gov/pub/irs-drop/rp-17-13.pdf"
      }
    ],
    "publication_citations": [
      {
        "cite": "IRS Written Determinations, PLR 202506001 (Feb. 7, 2025)",
        "url": "https://www.irs.gov/pub/irs-wd/202506001.pdf"
      }
    ],
    "terms": null,
    "status": "enforcing",
    "editorial_status": "published",
    "supersedes": null,
    "superseded_by": null,
    "authority_response": null,
    "last_verified": "2026-04-19",
    "timeline": [],
    "source_documents": []
  },
  "jsonld": {
    "@context": "https://schema.org",
    "@type": "LegalDocument",
    "identifier": "us-irs-chief-counsel-plr-2025-001",
    "alternateName": "PLR 202506001",
    "name": "IRS Private Letter Ruling 202506001 — Management Contract Private Business Use (§141)",
    "headline": "IRS Private Letter Ruling 202506001 — Management Contract Private Business Use (§141)",
    "description": "Private Letter Ruling (us)",
    "url": "https://publedge.org/us/federal/irs-chief-counsel/plr/2025-001/",
    "sameAs": [
      "https://www.irs.gov/pub/irs-wd/202506001.pdf"
    ],
    "dateCreated": "2026-04-19",
    "dateModified": "2026-04-19",
    "datePublished": "2025-02-07",
    "author": {
      "@type": "https://w3id.org/semanticarts/ns/ontology/gist/GovernmentOrganization",
      "name": "Internal Revenue Service, Office of Chief Counsel",
      "url": "https://www.irs.gov/privacy-disclosure/written-determinations"
    },
    "about": [
      {
        "@type": "Legislation",
        "name": "26 U.S.C. §141 (private business use of tax-exempt bond proceeds)",
        "url": "https://www.law.cornell.edu/uscode/text/26/141"
      },
      {
        "@type": "Legislation",
        "name": "Rev. Proc. 2017-13 (management-contract safe harbor)",
        "url": "https://www.irs.gov/pub/irs-drop/rp-17-13.pdf"
      }
    ],
    "license": "Demonstration remap of a publicly archived authority artifact. Not an authority-issued PubLedge instrument. The official source controls."
  }
}