{
  "@context": "https://schema.org",
  "meta": {
    "canonical_url": "https://publedge.org/us/utah/oaip/jia/2026-001/",
    "generated": "2026-09-23T00:00:00.000Z",
    "schema": "https://publedge.org/schema/instrument.schema.json",
    "admission": {
      "status": "reviewed-changes",
      "limits": "Traceability and declared review only; no automatic legal truth, completeness, authenticated reviewer identity, or currentness certification."
    }
  },
  "record": {
    "id": "us-ut-oaip-jia-2026-001",
    "legacy_id": null,
    "official_ref": null,
    "instance": "2026-001",
    "slug": "utah-mental-health-chatbot-disclosure-2026q2",
    "title": "PubLedge proposed template (unissued): Utah Mental Health Chatbot Disclosure",
    "type": "jia",
    "source": "publedge-original-draft",
    "jurisdiction": "us-ut",
    "authority": "utah-oaip",
    "url": "https://publedge.org/us/utah/oaip/jia/2026-001/",
    "issued_by": null,
    "author_or_proponent": "PubLedge",
    "intended_authority": "Utah Office of Artificial Intelligence Policy (OAIP)",
    "intended_authority_url": "https://commerce.utah.gov/ai/",
    "issuance_event": null,
    "enacted": null,
    "effective": null,
    "official_url": null,
    "obligation_kind": [
      "requirement",
      "permission"
    ],
    "reliance_scope": "requesting-party-only",
    "parties": [
      {
        "name": "PubLedge (illustrative requesting party)",
        "role": "requesting_party"
      },
      {
        "name": "Utah OAIP",
        "role": "interpreting_authority"
      }
    ],
    "statute_anchors": [
      {
        "cite": "Utah Code §13-72a-203",
        "url": "https://everyailaw.com/regulation/utah-sb149/#mental-health-chatbot-disclosure"
      },
      {
        "cite": "Utah HB0452 (2025)",
        "url": "https://le.utah.gov/~2025/bills/static/HB0452.html"
      }
    ],
    "publication_citations": [],
    "terms": [
      {
        "@type": "https://w3id.org/semanticarts/ns/ontology/gist/ContractTerm",
        "text": "Proposed interpretation: provider displays the standardized GenAI disclosure before first access and again on session resumption after 30 minutes of inactivity. The 30-minute re-display is a proposed term stricter than the statute's seven-day trigger, not a statutory requirement."
      }
    ],
    "status": "proposed",
    "editorial_status": "draft",
    "supersedes": null,
    "superseded_by": null,
    "authority_response": null,
    "last_verified": "2026-09-23",
    "timeline": [
      {
        "milestone": "Drafted",
        "date": "2026-04-15",
        "notes": "Initial PubLedge draft, suggested prior art"
      },
      {
        "milestone": "Reviewed",
        "date": "TBD",
        "notes": "Lawyer review pending"
      },
      {
        "milestone": "Published",
        "date": "TBD",
        "notes": "Not issued; remains a PubLedge draft pending lawyer review and authority sign-off"
      }
    ],
    "source_documents": []
  },
  "jsonld": {
    "@context": "https://schema.org",
    "@type": "LegalDocument",
    "identifier": "us-ut-oaip-jia-2026-001",
    "name": "PubLedge proposed template (unissued): Utah Mental Health Chatbot Disclosure",
    "headline": "PubLedge proposed template (unissued): Utah Mental Health Chatbot Disclosure",
    "description": "Joint Interpretation Agreement (us-ut)",
    "url": "https://publedge.org/us/utah/oaip/jia/2026-001/",
    "dateCreated": "2026-04-15",
    "dateModified": "2026-09-23",
    "author": {
      "@type": "Organization",
      "name": "PubLedge"
    },
    "about": [
      {
        "@type": "Legislation",
        "name": "Utah Code §13-72a-203",
        "url": "https://everyailaw.com/regulation/utah-sb149/#mental-health-chatbot-disclosure"
      },
      {
        "@type": "Legislation",
        "name": "Utah HB0452 (2025)",
        "url": "https://le.utah.gov/~2025/bills/static/HB0452.html"
      }
    ],
    "license": "Suggested prior art. Not authority-issued output. Awaiting lawyer review and authority sign-off before promotion."
  }
}